{
  "doc": "Clean daylight base look. Defines the standard material names every prefab uses; other looks extend it.",
  "sky": { "top": "#5f86b8", "horizon": "#c2d1de", "bottom": "#4a4e54" },
  "fog": { "color": "#b4c3d0", "near": 30, "far": 140 },
  "ambient": { "sky": "#dfe9ff", "ground": "#5a5048", "intensity": 1.1 },
  "sun": { "color": "#fff1dc", "intensity": 2.6, "dir": [-0.45, -1, -0.3], "shadows": true },
  "exposure": 1,
  "toneMapping": "agx",
  "post": "default",
  "materials": {
    "default": { "color": "#9a9a9a", "roughness": 0.8 },
    "floor": { "texture": "floor-tiles", "tile": 4, "roughness": 0.7 },
    "wall": { "texture": "plaster-panels", "tile": 4 },
    "ceiling": { "texture": "concrete", "tile": 4, "color": "#d0d0d0" },
    "concrete": { "texture": "concrete", "tile": 4 },
    "metal": { "texture": "metal-panel", "tile": 2, "metalness": 0.6, "roughness": 0.45 },
    "steel": { "color": "#8a9098", "metalness": 0.85, "roughness": 0.35 },
    "dark": { "color": "#26282c", "roughness": 0.6 },
    "white": { "color": "#e8e8e6", "roughness": 0.5 },
    "wood": { "texture": "planks", "tile": 3 },
    "crate": { "texture": "crate", "tile": 1 },
    "bricks": { "texture": "bricks", "tile": 3 },
    "rock": { "texture": "rock", "tile": 4 },
    "dirt": { "texture": "dirt", "tile": 4 },
    "grate": { "texture": "grate", "tile": 2, "metalness": 0.5 },
    "hazard": { "texture": "hazard", "tile": 2 },
    "lava": { "type": "glow", "texture": "lava", "tile": 4, "color": "#ff7a20", "emissiveIntensity": 1.2 },
    "accent": { "color": "#e0a030", "roughness": 0.5 },
    "glow": { "type": "glow", "color": "#ffd9a0", "emissiveIntensity": 2 },
    "glow-blue": { "type": "glow", "color": "#4ab8ff", "emissiveIntensity": 2.5 },
    "glow-red": { "type": "glow", "color": "#ff4a3a", "emissiveIntensity": 2.5 },
    "glow-green": { "type": "glow", "color": "#5aff7a", "emissiveIntensity": 2.5 },
    "glass": { "type": "glass", "color": "#a8d8ff", "opacity": 0.3 },
    "red": { "color": "#d83a34", "roughness": 0.45, "emissive": "#400000" },
    "blue": { "color": "#3a6ad8", "roughness": 0.45, "emissive": "#000a40" },
    "yellow": { "color": "#e4c23a", "roughness": 0.45, "emissive": "#302000" },
    "green": { "color": "#3ad86a", "roughness": 0.45, "emissive": "#003010" },
    "enemy": { "color": "#a8443a", "roughness": 0.55 },
    "enemy-dark": { "color": "#3a2826", "roughness": 0.7 },
    "enemy-eye": { "type": "glow", "color": "#ffef6a", "emissiveIntensity": 3 },
    "skin": { "color": "#c9a184", "roughness": 0.7 },
    "gun": { "color": "#2c2f34", "metalness": 0.7, "roughness": 0.35 },
    "gun-light": { "color": "#6a7078", "metalness": 0.8, "roughness": 0.3 },
    "water": { "type": "glass", "color": "#3a7ab8", "opacity": 0.6 }
  }
}
